stage_order,stage,records_remaining,records_removed,main_reason,scope_note,actual_study_context
3,Title/abstract screening,802,1604,Clearly irrelevant records were removed after title/abstract inspection.,Replication-package demonstration starts here,Actual study had already reduced 4010 records to this 802-record screening pool.
4,Introduction/conclusion screening,267,535,Records not sufficiently related to fairness requirements or AI-based software systems were removed after introduction/conclusion inspection.,Direct continuation of 802-record demonstration,This stage shows the first narrowing inside the metadata-backed demonstration subset.
5,Full-text assessment (database-screened set),107,160,Full-text inspection retained the database-screened set used before snowballing integration.,Database-screened subset after full-text screening,The manuscript figure then integrates snowballing additions before final QA.
5.5,Snowballing additions merged,137,-30,Snowballing contributed 30 additional studies that were merged with the database-screened set.,Demonstrates merge before QA,107 database-screened studies plus 30 snowballing additions yielded 137 studies for QA/integration.
6,Final primary studies,107,30,Final peer-reviewed primary studies retained for coding and synthesis after QA/final corpus audit.,End of demonstration and actual final corpus,This matches the manuscript final corpus of 107 primary studies.
